{
  "$schema": "https://json-schema.org/draft/2020-12/schema",
  "$id": "https://iambic.cc/data/poems.schema.json",
  "title": "Iambic demo poem library",
  "type": "array",
  "items": {
    "type": "object",
    "required": ["content", "title", "author", "url"],
    "properties": {
      "content": {"type": "string", "minLength": 1},
      "title": {"type": "string", "minLength": 1},
      "author": {"type": "string", "minLength": 1},
      "url": {"type": "string"}
    },
    "additionalProperties": false
  }
}
